ID	Type	Description	DataCoding
22052	Categorical (single)	UKBiLEVE unrelatedness indicator	101
22101	Text	Chromosome 1 genotype results
22102	Text	Chromosome 2 genotype results
22103	Text	Chromosome 3 genotype results
22104	Text	Chromosome 4 genotype results
22105	Text	Chromosome 5 genotype results
22106	Text	Chromosome 6 genotype results
22107	Text	Chromosome 7 genotype results
22108	Text	Chromosome 8 genotype results
22109	Text	Chromosome 9 genotype results
22110	Text	Chromosome 10 genotype results
22111	Text	Chromosome 11 genotype results
22112	Text	Chromosome 12 genotype results
22113	Text	Chromosome 13 genotype results
22114	Text	Chromosome 14 genotype results
22115	Text	Chromosome 15 genotype results
22116	Text	Chromosome 16 genotype results
22117	Text	Chromosome 17 genotype results
22118	Text	Chromosome 18 genotype results
22119	Text	Chromosome 19 genotype results
22120	Text	Chromosome 20 genotype results
22121	Text	Chromosome 21 genotype results
22122	Text	Chromosome 22 genotype results
22123	Text	Chromosome X genotype results
22124	Text	Chromosome Y genotype results
22125	Text	Mitochondrial genotype results
22126	Categorical (single)	Doctor diagnosed hayfever or allergic rhinitis	7
22127	Categorical (single)	Doctor diagnosed asthma	7
22128	Categorical (single)	Doctor diagnosed emphysema	7
22129	Categorical (single)	Doctor diagnosed chronic bronchitis	7
22130	Categorical (single)	Doctor diagnosed COPD (chronic obstructive pulmonary disease)	7
22131	Categorical (single)	Doctor diagnosed cystic fibrosis	7
22132	Categorical (single)	Doctor diagnosed alpha-1 antitrypsin deficiency	7
22133	Categorical (single)	Doctor diagnosed sarcoidosis	7
22134	Categorical (single)	Doctor diagnosed bronchiectasis	7
22135	Categorical (single)	Doctor diagnosed idiopathic pulmonary fibrosis	7
22136	Categorical (single)	Doctor diagnosed fibrosing alveolitis/unspecified alveolitis	7
22137	Categorical (single)	Doctor diagnosed tuberculosis	7
22138	Categorical (single)	Doctor diagnosed silicosis	7
22139	Categorical (single)	Doctor diagnosed asbestosis	7
22140	Categorical (single)	Doctor diagnosed lung cancer (not mesothelioma)	7
22141	Categorical (single)	Doctor diagnosed mesothelioma of the lung	7
22146	Integer	Age hayfever or allergic rhinitis diagnosed by doctor
22147	Integer	Age asthma diagnosed by doctor
22148	Integer	Age emphysema diagnosed by doctor
22149	Integer	Age chronic bronchitis diagnosed by doctor
22150	Integer	Age COPD (Chronic Obstructive Pulmonary Disease) diagnosed by doctor
22151	Integer	Age cystic fibrosis diagnosed by doctor
22152	Integer	Age alpha-1 antitrypsin deficiency diagnosed by doctor
22153	Integer	Age sarcoidosis diagnosed by doctor
22154	Integer	Age bronchiectasis diagnosed by doctor
22155	Integer	Age idiopathic pulmonary fibrosis diagnosed by doctor
22156	Integer	Age fibrosing alveolitis/unspecified alveolitis diagnosed by doctor
22157	Integer	Age tuberculosis diagnosed by doctor
22158	Integer	Age silicosis diagnosed by doctor
22159	Integer	Age asbestosis diagnosed by doctor
22160	Integer	Age lung cancer (not mesothelioma) diagnosed by doctor
22161	Integer	Age mesothelioma of the lung diagnosed by doctor
22166	Categorical (single)	Recent medication for hayfever or allergic rhinitis	7
22167	Categorical (single)	Recent medication for asthma	7
22168	Categorical (single)	Recent medication for emphysema	7
22169	Categorical (single)	Recent medication for chronic bronchitis	7
22170	Categorical (single)	Recent medication for COPD (Chronic Obstructive Pulmonary Disease)	7
22171	Categorical (single)	Recent medication for cystic fibrosis	7
22172	Categorical (single)	Recent medication for alpha-1 antitrypsin deficiency	7
22173	Categorical (single)	Recent medication for sarcoidosis	7
22174	Categorical (single)	Recent medication for bronchiectasis	7
22175	Categorical (single)	Recent medication for idiopathic pulmonary fibrosis	7
22176	Categorical (single)	Recent medication for fibrosing alveolitis/unspecified alveolitis	7
22177	Categorical (single)	Recent medication for tuberculosis	7
22178	Categorical (single)	Recent medication for silicosis	7
22179	Categorical (single)	Recent medication for asbestosis	7
22180	Categorical (single)	Recent medication for lung cancer (not mesothelioma)	7
22181	Categorical (single)	Recent medication for mesothelioma of the lung	7
22200	Integer	Year of birth
22201	Text	Chromosome 1 genotype probabilities
22202	Text	Chromosome 2 genotype probabilities
22203	Text	Chromosome 3 genotype probabilities
22204	Text	Chromosome 4 genotype probabilities
22205	Text	Chromosome 5 genotype probabilities
22206	Text	Chromosome 6 genotype probabilities
22207	Text	Chromosome 7 genotype probabilities
22208	Text	Chromosome 8 genotype probabilities
22209	Text	Chromosome 9 genotype probabilities
22210	Text	Chromosome 10 genotype probabilities
22211	Text	Chromosome 11 genotype probabilities
22212	Text	Chromosome 12 genotype probabilities
22213	Text	Chromosome 13 genotype probabilities
22214	Text	Chromosome 14 genotype probabilities
22215	Text	Chromosome 15 genotype probabilities
22216	Text	Chromosome 16 genotype probabilities
22217	Text	Chromosome 17 genotype probabilities
22218	Text	Chromosome 18 genotype probabilities
22219	Text	Chromosome 19 genotype probabilities
22220	Text	Chromosome 20 genotype probabilities
22221	Text	Chromosome 21 genotype probabilities
22222	Text	Chromosome 22 genotype probabilities
22223	Text	Chromosome X genotype probabilities
22224	Text	Chromosome Y genotype probabilities
22225	Text	Mitochondrial genotype probabilities
22301	Text	Chromosome 1 genotype intensities
22302	Text	Chromosome 2 genotype intensities
22303	Text	Chromosome 3 genotype intensities
22304	Text	Chromosome 4 genotype intensities
22305	Text	Chromosome 5 genotype intensities
22306	Text	Chromosome 6 genotype intensities
22307	Text	Chromosome 7 genotype intensities
22308	Text	Chromosome 8 genotype intensities
22309	Text	Chromosome 9 genotype intensities
22310	Text	Chromosome 10 genotype intensities
22311	Text	Chromosome 11 genotype intensities
22312	Text	Chromosome 12 genotype intensities
22313	Text	Chromosome 13 genotype intensities
22314	Text	Chromosome 14 genotype intensities
22315	Text	Chromosome 15 genotype intensities
22316	Text	Chromosome 16 genotype intensities
22317	Text	Chromosome 17 genotype intensities
22318	Text	Chromosome 18 genotype intensities
22319	Text	Chromosome 19 genotype intensities
22320	Text	Chromosome 20 genotype intensities
22321	Text	Chromosome 21 genotype intensities
22322	Text	Chromosome 22 genotype intensities
22323	Text	Chromosome X genotype intensities
22324	Text	Chromosome Y genotype intensities
22325	Text	Mitochondrial genotype intensities
22403	Continuous	Anterior thigh lean muscle volume (right)
22404	Continuous	Posterior thigh lean muscle volume (right)
22405	Continuous	Anterior thigh lean muscle volume (left)
22406	Continuous	Posterior thigh lean muscle volume (left)
22407	Continuous	Visceral adipose tissue volume (VAT)
22408	Continuous	Abdominal subcutaneous adipose tissue volume (ASAT)
22409	Continuous	Total thigh muscle volume
22410	Continuous	Total trunk fat
22411	Categorical (single)	VAT/ASAT error indicator	403
22412	Categorical (multiple)	Thigh error indicator (left)	401
22413	Categorical (multiple)	Thigh error indicator (right)	401
22414	Categorical (single)	Image quality indicator	400
22420	Integer	LV ejection fraction
22421	Integer	LV end diastolic volume
22422	Integer	LV end systolic volume
22423	Integer	LV stroke volume
22424	Continuous	Cardiac output
22425	Continuous	Cardiac index
22426	Integer	Average heart rate
22427	Continuous	Body surface area
22499	Categorical (single)	Device used to enter occupational data	480
22500	Date	When occupational data entered
22501	Integer	Year ended full time education	100306
22502	Categorical (single)	Cough on most days	7
22503	Integer	Years of cough on most days
22504	Categorical (single)	Bring up phlegm/sputum/mucus on most days	7
22505	Integer	Years of bringing up phlegm/sputum/mucus on most days
22506	Categorical (single)	Tobacco smoking	496
22507	Integer	Age of stopping smoking
22508	Integer	Amount of tobacco currently smoked	946
22599	Integer	Number of jobs held
22600	Text	Job title
22601	Categorical (single)	Job coding	497
22602	Integer	Year job started
22603	Integer	Year job ended	100698
22604	Categorical (single)	Work hours - lumped category	494
22605	Continuous	Work hours per week - exact value
22606	Categorical (single)	Workplace very noisy	493
22607	Categorical (single)	Workplace very cold	493
22608	Categorical (single)	Workplace very hot	493
22609	Categorical (single)	Workplace very dusty	493
22610	Categorical (single)	Workplace full of chemical or other fumes	493
22611	Categorical (single)	Workplace had a lot of cigarette smoke from other people smoking	493
22612	Categorical (single)	Worked with materials containing asbestos	493
22613	Categorical (single)	Worked with paints, thinners or glues	493
22614	Categorical (single)	Worked with pesticides	493
22615	Categorical (single)	Workplace had a lot of diesel exhaust	493
22616	Categorical (single)	Breathing problems during period of job	7
22617	Categorical (single)	Job SOC coding	2
22618	Categorical (single)	Breathing problems improved/stopped away from workplace or on holiday	7
22619	Categorical (single)	Breathing problems responsible for leaving job	7
22620	Categorical (single)	Job involved shift work	7
22630	Categorical (single)	Day shifts worked	489
22631	Continuous	Period spent working day shifts
22640	Categorical (single)	Mixture of day and night shifts worked	489
22641	Continuous	Period spent working mix of day and night shifts	488
22642	Integer	Usual length of each night shift during mixed shift periods
22643	Integer	Number of night shifts worked monthly during mixed shift periods
22644	Integer	Consecutive night shifts during mixed shift periods	487
22645	Integer	Rest days during mixed shift periods	487
22650	Categorical (single)	Night shifts worked	489
22651	Continuous	Period spent working night shifts	488
22652	Integer	Usual length of each night shift during night shift periods
22653	Integer	Number of night shifts worked monthly during night shift periods
22654	Integer	Consecutive night shifts during night shift periods	487
22655	Integer	Rest days during night shift periods	487
22660	Categorical (single)	Gap coding	486
22661	Integer	Number of gap periods
22662	Text	Title for other gap
22663	Integer	Year gap started
22664	Integer	Year gap ended	100698
22700	Date	Date first recorded at location
22702	Integer	Home location - east co-ordinate (rounded)
22704	Integer	Home location - north co-ordinate (rounded)
23098	Continuous	Weight
23099	Continuous	Body fat percentage
23100	Continuous	Whole body fat mass
23101	Continuous	Whole body fat-free mass
23102	Continuous	Whole body water mass
23104	Continuous	Body mass index (BMI)
23105	Continuous	Basal metabolic rate
23106	Continuous	Impedance of whole body
23107	Continuous	Impedance of leg (right)
23108	Continuous	Impedance of leg (left)
23109	Continuous	Impedance of arm (right)
23110	Continuous	Impedance of arm (left)
23111	Continuous	Leg fat percentage (right)
23112	Continuous	Leg fat mass (right)
23113	Continuous	Leg fat-free mass (right)
23114	Continuous	Leg predicted mass (right)
23115	Continuous	Leg fat percentage (left)
23116	Continuous	Leg fat mass (left)
23117	Continuous	Leg fat-free mass (left)
23118	Continuous	Leg predicted mass (left)
23119	Continuous	Arm fat percentage (right)
23120	Continuous	Arm fat mass (right)
23121	Continuous	Arm fat-free mass (right)
23122	Continuous	Arm predicted mass (right)
23123	Continuous	Arm fat percentage (left)
23124	Continuous	Arm fat mass (left)
23125	Continuous	Arm fat-free mass (left)
23126	Continuous	Arm predicted mass (left)
23127	Continuous	Trunk fat percentage
23128	Continuous	Trunk fat mass
23129	Continuous	Trunk fat-free mass
23130	Continuous	Trunk predicted mass
23200	Continuous	L1-L4 area
23201	Continuous	L1-L4 average height
23202	Continuous	L1-L4 average width
23203	Continuous	L1-L4 BMC (bone mineral content)
23204	Continuous	L1-L4 BMD (bone mineral density)
23205	Continuous	L1-L4 BMD (bone mineral density) T-score
23206	Continuous	Femur lower neck BMD (bone mineral density) (right)
23208	Continuous	Femur neck BMD (bone mineral density) (right)
23209	Continuous	Femur neck BMD (bone mineral density) T-score (right)
23210	Continuous	Femur shaft BMD (bone mineral density) (right)
23212	Continuous	Femur total BMD (bone mineral density) (right)
23213	Continuous	Femur total BMD (bone mineral density) T-score (right)
23214	Continuous	Femur troch BMD (bone mineral density) (right)
23215	Continuous	Femur troch BMD (bone mineral density) T-score (right)
23216	Continuous	Femur upper neck BMD (bone mineral density) (right)
23217	Continuous	Femur upper neck BMD (bone mineral density) T-score (right)
23218	Continuous	Femur wards BMD (bone mineral density) (right)
23219	Continuous	Femur wards BMD (bone mineral density) T-score (right)
23220	Continuous	Arm BMC (bone mineral content) (left)
23221	Continuous	Arm BMD (bone mineral density) (left)
23222	Continuous	Arm BMC (bone mineral content) (right)
23223	Continuous	Arm BMD (bone mineral density) (right)
23224	Continuous	Arms BMC (bone mineral content)
23225	Continuous	Arms BMD (bone mineral density)
23226	Continuous	Head BMD (bone mineral density)
23227	Continuous	Leg BMD (bone mineral density) (left)
23228	Continuous	Leg BMC (bone mineral content) (right)
23229	Continuous	Leg BMD (bone mineral density) (right)
23230	Continuous	Legs BMC (bone mineral content)
23231	Continuous	Legs BMD (bone mineral density)
23232	Continuous	Pelvis BMD (bone mineral density)
23233	Continuous	Ribs BMD (bone mineral density)
23234	Continuous	Spine BMD (bone mineral density)
23235	Continuous	Total BMC (bone mineral content)
23236	Continuous	Total BMD (bone mineral density)
23237	Continuous	Total BMD (bone mineral density) (left)
23238	Continuous	Total BMD (bone mineral density) (right)
23239	Continuous	Total BMD (bone mineral density) T-score
23240	Continuous	Trunk BMC (bone mineral content)
23241	Continuous	Trunk BMD (bone mineral density)
23242	Continuous	Trunk BMD (bone mineral density) (left)
23243	Continuous	Trunk BMD (bone mineral density) (right)
23244	Integer	Android bone mass
23245	Integer	Android fat mass
23246	Integer	Android lean mass
23247	Continuous	Android tissue fat percentage
23248	Continuous	Android total mass
23249	Integer	Arm fat mass (left)
23250	Integer	Arm lean mass (left)
23251	Continuous	Arm tissue fat percentage (left)
23252	Continuous	Arm total mass (left)
23253	Integer	Arm fat mass (right)
23254	Integer	Arm lean mass (right)
23255	Continuous	Arm tissue fat percentage (right)
23256	Continuous	Arm total mass (right)
23257	Integer	Arms fat mass
23258	Integer	Arms lean mass
23259	Continuous	Arms tissue fat percentage
23260	Continuous	Arms total mass
23261	Integer	Gynoid bone mass
23262	Integer	Gynoid fat mass
23263	Integer	Gynoid lean mass
23264	Continuous	Gynoid tissue fat percentage
23265	Continuous	Gynoid total mass
23266	Integer	Leg fat mass (left)
23267	Integer	Leg lean mass (left)
23268	Continuous	Leg tissue fat percentage (left)
23269	Continuous	Leg total mass (left)
23270	Integer	Leg fat mass (right)
23271	Integer	Leg lean mass (right)
23272	Continuous	Leg tissue fat percentage (right)
23273	Continuous	Leg total mass (right)
23274	Integer	Legs fat mass
23275	Integer	Legs lean mass
23276	Continuous	Legs tissue fat percentage
23277	Continuous	Legs total mass
23278	Integer	Total fat mass
23279	Integer	Total fat-free mass
23280	Integer	Total lean mass
23281	Continuous	Total tissue fat percentage
23282	Integer	Total tissue mass
23283	Continuous	Total mass
23284	Integer	Trunk fat mass
23285	Integer	Trunk lean mass
23286	Continuous	Trunk tissue fat percentage
23287	Continuous	Trunk total mass
23288	Integer	VAT (visceral adipose tissue) mass
23289	Integer	VAT (visceral adipose tissue) volume
23290	Continuous	Femur shaft BMD (bone mineral density) (left)
23291	Continuous	Femur total BMD (bone mineral density) (left)
23292	Continuous	Femur upper neck BMD (bone mineral density) (left)
23293	Continuous	Femur total BMD (bone mineral density) T-score (left)
23295	Continuous	Femur troch BMD (bone mineral density) (left)
23296	Continuous	Femur upper neck BMD (bone mineral density) T-score (left)
23297	Continuous	Femur wards BMD (bone mineral density) (left)
23298	Continuous	Femur troch BMD (bone mineral density) T-score (left)
23299	Continuous	Femur neck BMD (bone mineral density) (left)
23300	Continuous	Femur neck BMD (bone mineral density) T-score (left)
23301	Continuous	Femur wards BMD (bone mineral density) T-score (left)
23302	Continuous	Femur lower neck BMD (bone mineral density) (left)
23304	Continuous	Trunk bone area
23305	Continuous	Head bone area
23306	Continuous	Head BMC (bone mineral content)
23307	Continuous	Pelvis bone area
23308	Continuous	Pelvis BMC (bone mineral content)
23309	Continuous	Ribs bone area
23310	Continuous	Ribs BMC (bone mineral content)
23311	Continuous	Spine bone area
23312	Continuous	Spine BMC (bone mineral content)
23313	Continuous	Arm bone area (left)
23314	Continuous	Arm bone area (right)
23315	Continuous	Leg bone area (left)
23316	Continuous	Leg bone area (right)
23317	Continuous	Arms combined bone area
23318	Continuous	Legs combined bone area
23320	Continuous	Leg BMC (bone mineral content) (left)
25000	Continuous	Volumetric scaling from T1 head image to standard space
25001	Continuous	Volume of peripheral cortical grey matter (normalised for head size)
25002	Continuous	Volume of peripheral cortical grey matter
25003	Continuous	Volume of ventricular cerebrospinal fluid (normalised for head size)
25004	Continuous	Volume of ventricular cerebrospinal fluid
25005	Continuous	Volume of grey matter (normalised for head size)
25006	Continuous	Volume of grey matter
25007	Continuous	Volume of white matter (normalised for head size)
25008	Continuous	Volume of white matter
25009	Continuous	Volume of brain, grey+white matter (normalised for head size)
25010	Continuous	Volume of brain, grey+white matter
25011	Continuous	Volume of thalamus (left)
25012	Continuous	Volume of thalamus (right)
25013	Continuous	Volume of caudate (left)
25014	Continuous	Volume of caudate (right)
25015	Continuous	Volume of putamen (left)
25016	Continuous	Volume of putamen (right)
25017	Continuous	Volume of pallidum (left)
25018	Continuous	Volume of pallidum (right)
25019	Continuous	Volume of hippocampus (left)
25020	Continuous	Volume of hippocampus (right)
25021	Continuous	Volume of amygdala (left)
25022	Continuous	Volume of amygdala (right)
25023	Continuous	Volume of accumbens (left)
25024	Continuous	Volume of accumbens (right)
25025	Continuous	Volume of brain stem + 4th ventricle
25026	Continuous	Median T2star in thalamus (left)
25027	Continuous	Median T2star in thalamus (right)
25028	Continuous	Median T2star in caudate (left)
25029	Continuous	Median T2star in caudate (right)
25030	Continuous	Median T2star in putamen (left)
25031	Continuous	Median T2star in putamen (right)
25032	Continuous	Median T2star in pallidum (left)
25033	Continuous	Median T2star in pallidum (right)
25034	Continuous	Median T2star in hippocampus (left)
25035	Continuous	Median T2star in hippocampus (right)
25036	Continuous	Median T2star in amygdala (left)
25037	Continuous	Median T2star in amygdala (right)
25038	Continuous	Median T2star in accumbens (left)
25039	Continuous	Median T2star in accumbens (right)
25040	Continuous	Median BOLD effect (in group-defined mask) for shapes activation
25042	Continuous	Median z-statistic (in group-defined mask) for shapes activation
25044	Continuous	Median BOLD effect (in group-defined mask) for faces activation
25046	Continuous	Median z-statistic (in group-defined mask) for faces activation
25048	Continuous	Median BOLD effect (in group-defined mask) for faces-shapes contrast
25050	Continuous	Median z-statistic (in group-defined mask) for faces-shapes contrast
25052	Continuous	Median BOLD effect (in group-defined amygdala activation mask) for faces-shapes contrast
25054	Continuous	Median z-statistic (in group-defined amygdala activation mask) for faces-shapes contrast
25056	Continuous	Mean FA in middle cerebellar peduncle on FA skeleton
25057	Continuous	Mean FA in pontine crossing tract on FA skeleton
25058	Continuous	Mean FA in genu of corpus callosum on FA skeleton
25059	Continuous	Mean FA in body of corpus callosum on FA skeleton
25060	Continuous	Mean FA in splenium of corpus callosum on FA skeleton
25061	Continuous	Mean FA in fornix on FA skeleton
25062	Continuous	Mean FA in corticospinal tract on FA skeleton (right)
25063	Continuous	Mean FA in corticospinal tract on FA skeleton (left)
25064	Continuous	Mean FA in medial lemniscus on FA skeleton (right)
25065	Continuous	Mean FA in medial lemniscus on FA skeleton (left)
25066	Continuous	Mean FA in inferior cerebellar peduncle on FA skeleton (right)
25067	Continuous	Mean FA in inferior cerebellar peduncle on FA skeleton (left)
25068	Continuous	Mean FA in superior cerebellar peduncle on FA skeleton (right)
25069	Continuous	Mean FA in superior cerebellar peduncle on FA skeleton (left)
25070	Continuous	Mean FA in cerebral peduncle on FA skeleton (right)
25071	Continuous	Mean FA in cerebral peduncle on FA skeleton (left)
25072	Continuous	Mean FA in anterior limb of internal capsule on FA skeleton (right)
25073	Continuous	Mean FA in anterior limb of internal capsule on FA skeleton (left)
25074	Continuous	Mean FA in posterior limb of internal capsule on FA skeleton (right)
25075	Continuous	Mean FA in posterior limb of internal capsule on FA skeleton (left)
25076	Continuous	Mean FA in retrolenticular part of internal capsule on FA skeleton (right)
25077	Continuous	Mean FA in retrolenticular part of internal capsule on FA skeleton (left)
25078	Continuous	Mean FA in anterior corona radiata on FA skeleton (right)
25079	Continuous	Mean FA in anterior corona radiata on FA skeleton (left)
25080	Continuous	Mean FA in superior corona radiata on FA skeleton (right)
25081	Continuous	Mean FA in superior corona radiata on FA skeleton (left)
25082	Continuous	Mean FA in posterior corona radiata on FA skeleton (right)
25083	Continuous	Mean FA in posterior corona radiata on FA skeleton (left)
25084	Continuous	Mean FA in posterior thalamic radiation on FA skeleton (right)
25085	Continuous	Mean FA in posterior thalamic radiation on FA skeleton (left)
25086	Continuous	Mean FA in sagittal stratum on FA skeleton (right)
25087	Continuous	Mean FA in sagittal stratum on FA skeleton (left)
25088	Continuous	Mean FA in external capsule on FA skeleton (right)
25089	Continuous	Mean FA in external capsule on FA skeleton (left)
25090	Continuous	Mean FA in cingulum cingulate gyrus on FA skeleton (right)
25091	Continuous	Mean FA in cingulum cingulate gyrus on FA skeleton (left)
25092	Continuous	Mean FA in cingulum hippocampus on FA skeleton (right)
25093	Continuous	Mean FA in cingulum hippocampus on FA skeleton (left)
25094	Continuous	Mean FA in fornix cres+stria terminalis on FA skeleton (right)
25095	Continuous	Mean FA in fornix cres+stria terminalis on FA skeleton (left)
25096	Continuous	Mean FA in superior longitudinal fasciculus on FA skeleton (right)
25097	Continuous	Mean FA in superior longitudinal fasciculus on FA skeleton (left)
25098	Continuous	Mean FA in superior fronto-occipital fasciculus on FA skeleton (right)
25099	Continuous	Mean FA in superior fronto-occipital fasciculus on FA skeleton (left)
25100	Continuous	Mean FA in uncinate fasciculus on FA skeleton (right)
25101	Continuous	Mean FA in uncinate fasciculus on FA skeleton (left)
25102	Continuous	Mean FA in tapetum on FA skeleton (right)
25103	Continuous	Mean FA in tapetum on FA skeleton (left)
25104	Continuous	Mean MD in middle cerebellar peduncle on FA skeleton
25105	Continuous	Mean MD in pontine crossing tract on FA skeleton
25106	Continuous	Mean MD in genu of corpus callosum on FA skeleton
25107	Continuous	Mean MD in body of corpus callosum on FA skeleton
25108	Continuous	Mean MD in splenium of corpus callosum on FA skeleton
25109	Continuous	Mean MD in fornix on FA skeleton
25110	Continuous	Mean MD in corticospinal tract on FA skeleton (right)
25111	Continuous	Mean MD in corticospinal tract on FA skeleton (left)
25112	Continuous	Mean MD in medial lemniscus on FA skeleton (right)
25113	Continuous	Mean MD in medial lemniscus on FA skeleton (left)
25114	Continuous	Mean MD in inferior cerebellar peduncle on FA skeleton (right)
25115	Continuous	Mean MD in inferior cerebellar peduncle on FA skeleton (left)
25116	Continuous	Mean MD in superior cerebellar peduncle on FA skeleton (right)
25117	Continuous	Mean MD in superior cerebellar peduncle on FA skeleton (left)
25118	Continuous	Mean MD in cerebral peduncle on FA skeleton (right)
25119	Continuous	Mean MD in cerebral peduncle on FA skeleton (left)
25120	Continuous	Mean MD in anterior limb of internal capsule on FA skeleton (right)
25121	Continuous	Mean MD in anterior limb of internal capsule on FA skeleton (left)
25122	Continuous	Mean MD in posterior limb of internal capsule on FA skeleton (right)
25123	Continuous	Mean MD in posterior limb of internal capsule on FA skeleton (left)
25124	Continuous	Mean MD in retrolenticular part of internal capsule on FA skeleton (right)
25125	Continuous	Mean MD in retrolenticular part of internal capsule on FA skeleton (left)
25126	Continuous	Mean MD in anterior corona radiata on FA skeleton (right)
25127	Continuous	Mean MD in anterior corona radiata on FA skeleton (left)
25128	Continuous	Mean MD in superior corona radiata on FA skeleton (right)
25129	Continuous	Mean MD in superior corona radiata on FA skeleton (left)
25130	Continuous	Mean MD in posterior corona radiata on FA skeleton (right)
25131	Continuous	Mean MD in posterior corona radiata on FA skeleton (left)
25132	Continuous	Mean MD in posterior thalamic radiation on FA skeleton (right)
